title,company,url,matched_skills,email
Senior Data Scientist,Lemon.io,https://remotive.com/remote-jobs/data/senior-data-scientist-2090982,"python, flask","**Subject: Application for Senior Data Scientist Position**

Dear Hiring Team at Lemon.io,

My name is Araj, and I am a Python developer based in Toronto. I am writing to express my interest in the Senior Data Scientist position.

I bring hands-on experience with Python, pandas, Flask, BeautifulSoup, Git/GitHub, Claude API, and cloud deployment via Render. My recent projects include a **live Nepal news dashboard** that scrapes and displays real-time headlines, and a **job automation tool** that streamlines application workflows — both deployed and functional in production.

I am comfortable working with data pipelines, APIs, web scraping, and building end-to-end solutions from development to deployment. I thrive in fast-paced, remote environments and am eager to contribute to Lemon.io's talent network.

I would welcome the opportunity to discuss how my skills align with your needs.

Best regards,
Araj
Toronto, Canada"
iOS Developer,nooro,https://remotive.com/remote-jobs/software-development/ios-developer-1956455,api,"Subject: Application for iOS Developer Position – Araj

Dear Hiring Team at Nooro,

I hope this message finds you well. My name is Araj, a software developer based in Toronto, and I am writing to express my interest in the iOS Developer position.

While my primary experience is in Python development—including Flask, pandas, BeautifulSoup, and the Claude API—I am eager to transition into iOS development and bring my strong programming fundamentals to your team. I have built and deployed live projects, including a Nepal news dashboard and a job automation tool, demonstrating my ability to ship functional products end to end. I am comfortable with Git, GitHub, and cloud deployment via Render.

I am a fast learner, passionate about mobile development, and ready to upskill in Swift and SwiftUI to contribute meaningfully at Nooro.

I would welcome the opportunity to discuss how I can add value to your team.

Best regards,
Araj"
Senior Full-stack React Developer,Lemon.io,https://remotive.com/remote-jobs/software-development/senior-full-stack-react-developer-2088711,"python, flask","**Subject: Application – Senior Full-stack React Developer**

Dear Lemon.io Hiring Team,

My name is Araj, and I am a Python developer based in Toronto. I am writing to express my interest in the Senior Full-stack React Developer position.

I have hands-on experience building and deploying web applications using Python, Flask, Claude API, pandas, and BeautifulSoup. My recent projects include a live Nepal news dashboard and a job automation tool, both deployed via Render and managed through Git/GitHub.

While my core strength is in Python and back-end development, I am actively expanding my front-end skills in React and am eager to grow into a full-stack role. I am a fast learner with a strong foundation in building functional, data-driven applications.

I would welcome the opportunity to discuss how my skills and enthusiasm can contribute to your team.

Thank you for your consideration.

Best regards,
Araj
Toronto, Canada"
Tech Lead Full-Stack Rails Engineer,Mitre Media,https://remotive.com/remote-jobs/software-development/tech-lead-full-stack-rails-engineer-2069746,api,"Subject: Application for Tech Lead Full-Stack Rails Engineer

Dear Hiring Team at Mitre Media,

My name is Araj, and I am a Python developer based in Toronto writing to express my interest in the Tech Lead Full-Stack Rails Engineer position.

I bring hands-on experience with Python, Flask, BeautifulSoup, Claude API, pandas, Git, and cloud deployment on Render. I have built and deployed a live Nepal news dashboard and a job automation tool, demonstrating my ability to deliver end-to-end solutions independently.

While my primary stack is Python, I am eager to expand into Ruby on Rails and full-stack development. My strong fundamentals in web frameworks, API integration, data processing, and version control provide a solid foundation for a smooth transition.

I would welcome the opportunity to discuss how my skills and drive can contribute to your team.

Thank you for your consideration.

Best regards,
Araj
Toronto, Canada"
